train,stations
<<<<<<< HEAD
train_1,"[Delft, Schiedam Centrum, Rotterdam Centraal, Rotterdam Alexander, Rotterdam Blaak, Dordrecht, Breda, Etten-Leur, Roosendaal, Dordrecht, Rotterdam Centraal]"
train_2,"[Helmond, Eindhoven, Weert, Roermond, Sittard, Heerlen]"
train_3,"[Oss, s-Hertogenbosch, Utrecht Centraal, Hilversum, Amsterdam Amstel, Almere Centrum, Amsterdam Centraal, Amsterdam Amstel, Utrecht Centraal]"
train_4,"[Arnhem Centraal, Dieren, Zutphen, Apeldoorn, Amersfoort, Utrecht Centraal, Gouda, Den Haag Centraal, Leiden Centraal, Alphen a/d Rijn, Utrecht Centraal]"
train_5,"[Alphen a/d Rijn, Utrecht Centraal, Schiphol Airport, Leiden Centraal, Den Haag Laan v NOI, Gouda, Utrecht Centraal, Ede-Wageningen, Arnhem Centraal, Dieren]"
train_6,"[Breda, Dordrecht, Rotterdam Blaak, Schiedam Centrum, Delft, Den Haag HS, Gouda, Rotterdam Alexander, Rotterdam Centraal, Schiedam Centrum]"
train_7,"[Enschede, Hengelo, Almelo, Zwolle, Steenwijk, Heerenveen, Leeuwarden, Groningen, Assen]"
train_8,"[Schiphol Airport, Amsterdam Zuid, Amsterdam Sloterdijk, Amsterdam Centraal, Utrecht Centraal, Hilversum, Almere Centrum, Amsterdam Amstel, Utrecht Centraal, Amersfoort]"
train_9,"[Apeldoorn, Deventer, Almelo, Zwolle, Assen, Groningen, Leeuwarden]"
train_10,"[Enschede, Hengelo, Almelo, Zwolle, Amersfoort, Utrecht Centraal, Ede-Wageningen, Arnhem Centraal, Dieren, Zutphen, Deventer]"
train_11,"[Zutphen, Deventer, Apeldoorn, Zutphen, Dieren, Arnhem Centraal, Nijmegen, Oss, s-Hertogenbosch, Tilburg, Eindhoven, Helmond, Venlo]"
train_12,"[Den Helder, Alkmaar, Castricum, Beverwijk, Zaandam, Hoorn, Alkmaar]"
train_13,"[Oss, s-Hertogenbosch, Eindhoven, Tilburg, s-Hertogenbosch, Utrecht Centraal, Amersfoort, Apeldoorn, Zutphen, Deventer]"
train_14,"[Castricum, Zaandam, Beverwijk, Castricum, Alkmaar, Den Helder]"
train_15,"[Schiphol Airport, Amsterdam Zuid, Amsterdam Sloterdijk, Haarlem, Heemstede-Aerdenhout, Leiden Centraal, Den Haag HS, Gouda, Alphen a/d Rijn, Leiden Centraal, Schiphol Airport, Utrecht Centraal]"
train_16,"[Venlo, Helmond, Eindhoven, Weert, Roermond, Sittard, Heerlen]"
train_17,"[Helmond, Eindhoven, s-Hertogenbosch, Oss, Nijmegen, Arnhem Centraal, Dieren, Zutphen, Deventer, Zwolle, Almelo, Hengelo]"
train_18,"[Dordrecht, Roosendaal, Vlissingen]"
train_19,"[Venlo, Helmond, Eindhoven, s-Hertogenbosch, Utrecht Centraal, Amsterdam Centraal, Almere Centrum, Hilversum, Utrecht Centraal]"
train_20,"[Sittard, Roermond, Weert, Eindhoven, Helmond, Venlo]"
score,4300.123595505618
=======
<<<<<<< HEAD
train_1,"[Haarlem, Amsterdam Sloterdijk, Zaandam, Hoorn, Alkmaar, Castricum, Beverwijk, Haarlem, Heemstede-Aerdenhout]"
train_2,"[Amsterdam Sloterdijk, Amsterdam Centraal, Amsterdam Amstel, Amsterdam Zuid, Schiphol Airport, Leiden Centraal, Heemstede-Aerdenhout, Haarlem, Beverwijk, Zaandam, Castricum]"
train_3,"[Schiedam Centrum, Rotterdam Centraal, Dordrecht]"
train_4,"[Amsterdam Centraal, Amsterdam Sloterdijk, Amsterdam Zuid, Amsterdam Amstel, Amsterdam Centraal]"
train_5,"[Leiden Centraal, Alphen a/d Rijn, Gouda, Rotterdam Alexander, Rotterdam Centraal, Schiedam Centrum, Delft, Den Haag Centraal, Gouda]"
train_6,"[Leiden Centraal, Heemstede-Aerdenhout, Haarlem, Amsterdam Sloterdijk, Amsterdam Zuid, Amsterdam Amstel, Amsterdam Centraal, Amsterdam Sloterdijk, Zaandam, Castricum, Beverwijk]"
train_7,"[Amsterdam Amstel, Amsterdam Zuid, Amsterdam Sloterdijk, Amsterdam Centraal, Amsterdam Amstel]"
score,8060.714285714286
=======
train_1,"[Dordrecht, Rotterdam Blaak, Schiedam Centrum, Delft, Den Haag HS, Gouda, Alphen a/d Rijn, Leiden Centraal, Den Haag HS]"
train_2,"[Amsterdam Centraal, Almere Centrum, Hilversum, Utrecht Centraal, Alphen a/d Rijn, Leiden Centraal, Heemstede-Aerdenhout, Haarlem, Beverwijk, Zaandam, Amsterdam Sloterdijk, Haarlem]"
train_3,"[Enschede, Hengelo, Almelo, Zwolle, Steenwijk, Heerenveen, Leeuwarden, Groningen, Assen]"
train_4,"[Delft, Den Haag HS, Leiden Centraal, Alphen a/d Rijn, Utrecht Centraal, Schiphol Airport, Amsterdam Zuid, Amsterdam Amstel, Hilversum, Almere Centrum]"
train_5,"[Amsterdam Zuid, Amsterdam Sloterdijk, Zaandam, Hoorn, Alkmaar, Castricum, Beverwijk, Zaandam, Castricum]"
train_6,"[Oss, Nijmegen, Arnhem Centraal, Ede-Wageningen, Utrecht Centraal, Alphen a/d Rijn, Gouda, Utrecht Centraal, Amsterdam Centraal, Amsterdam Sloterdijk, Haarlem, Heemstede-Aerdenhout]"
train_7,"[Hengelo, Almelo, Zwolle, Deventer, Apeldoorn, Amersfoort, Utrecht Centraal, Schiphol Airport, Amsterdam Zuid, Amsterdam Amstel]"
train_8,"[Steenwijk, Heerenveen, Leeuwarden, Groningen, Assen, Zwolle, Steenwijk]"
train_9,"[Maastricht, Sittard, Heerlen]"
train_10,"[Dordrecht, Rotterdam Blaak, Schiedam Centrum, Rotterdam Centraal, Rotterdam Alexander, Rotterdam Blaak]"
train_11,"[Almere Centrum, Lelystad Centrum]"
train_12,"[Heerlen, Sittard, Roermond, Weert, Eindhoven, Helmond, Venlo]"
train_13,"[Dieren, Zutphen, Apeldoorn, Deventer, Zwolle, Almelo, Deventer, Zutphen]"
train_14,"[Nijmegen, Arnhem Centraal, Dieren, Zutphen, Deventer, Almelo, Zwolle, Deventer, Apeldoorn, Zutphen]"
train_15,"[Den Haag Laan v NOI, Delft, Den Haag Centraal, Leiden Centraal, Alphen a/d Rijn, Gouda, Den Haag HS, Leiden Centraal, Den Haag Laan v NOI, Gouda, Utrecht Centraal]"
train_16,"[Assen, Groningen, Leeuwarden, Heerenveen, Steenwijk, Zwolle, Amersfoort, Apeldoorn, Deventer]"
train_17,"[Den Helder, Alkmaar, Hoorn, Zaandam, Amsterdam Sloterdijk, Amsterdam Centraal, Almere Centrum, Amsterdam Amstel, Hilversum]"
train_18,"[Alkmaar, Castricum, Beverwijk, Zaandam, Amsterdam Sloterdijk, Amsterdam Zuid, Amsterdam Amstel, Almere Centrum, Hilversum, Utrecht Centraal, s-Hertogenbosch]"
train_19,"[Amsterdam Sloterdijk, Zaandam, Hoorn, Alkmaar, Castricum, Beverwijk, Haarlem, Amsterdam Sloterdijk, Amsterdam Zuid, Schiphol Airport, Leiden Centraal, Alphen a/d Rijn]"
train_20,"[Helmond, Eindhoven, Weert, Roermond, Sittard, Heerlen]"
score,3670.606741573034
>>>>>>> 6549babda8a7956db2906c7eba8dd8aa8765c9d8
>>>>>>> 98bd431266b760760245603837723d76ee543605
